Artikelnr;acc_name;Gesamtnr;row;ausg_nr;beznr_komm;relative_date;text;
1;Schvartur;449;3;447;447;2015-11-20 07:59;In fact, I find the course of action unconstitutional and it has nothing to do with nagging, but with the fact that inescapable facts are being created and a state that does not protect its borders will end up becoming a constitutional state.I would recognize democratic customs, if current policies were in any party program.The fact is, at a party congress of the CDU, our dearest Roman Herzog made a speech and clarified that with immigration as we operate it can not solve the demographic problems, this was in 2003 and subsequently, the CDU has always spoken out against immigration law.That, in turn, I have considered wrong, I see the classical immigration countries with their experience as a model results, whose points systems you can take.In 2013 this demanded the AfD. The established parties roared once again from the right, just so that the SPD has taken over this requirement in their party program below.So, when we talk about democracy, we should also live it de fi nitively  according to our constitution, all power emanates from the German people.However, in some of them this is already going to be right-wing extremist, then I seem to seek the right of self-determination of the peoples, which is attributed to all peoples, apparently not the German.As far as the NSA is concerned, Ms Merkel should have taken her hat as responsible.;
1;pattso;450;2;444;444;2015-11-20 08:00;"If Ms. Merkel's statements and her dealings were not covered by constitutional law, why has nobody complained in recent months?If the government's actions were not covered by European law, why has nobody complained to the EUJ?""What is established in Germany by the established parties is totalitarian, undemocratic politics that are deeply damaging for Europe and Germany.""What is currently in Germany is a miserable howling, hate speech, slander and fear mongering. Haltless statements and populism.Should I look for the addresses of the BVG and the EUJG or do you do that yourself? Just complain. Go ahead, the way is open.""and stands outside the constitution for me."" Irrelevant. They are not the BVG.";
1;ZweiundZweigleichVier;451;3;450;450;2015-11-20 08:01;If you have little idea, you should not go too far out the window, I mean. The User Schvartur is right. I can explain that to you now, but just google it under parliamentary reservation, the theory of essence and Art 38 GG. There they are helped. In one of my posts last night I've been running long and wide. You are also welcome to search there.;
1;Heribert Pilch;452;4;449;449;2015-11-20 08:02;"according to our constitution, all power emanates from the German people.... and this power exercises it in elections and votes. Now you can not claim that you were prevented from voting, right?""Self-determination of peoples"" likes to explain:h ps: //de.wikipedia.org / ...No state and no ethnic minority within Germany are attacking this right. The annexation of Crimea or Tibet, for example, is a violation of it. Even the Kurds with 40 million people are without a state and reclaim from this right one.What this has to do with the CSU party congress and the refugee crisis, does not open to me.";
1;Schvartur;453;3;450;450;2015-11-20 08:03;With this text, they themselves lead to absurdity.Any text here in the forums is otherwise irrelevant. She does not care what she or I think.Cheer on, today this government operates politics in their favor. But what will they do if this government does not do this anymore?Whine, howl, teeth rattle?Or if the evil right comes and then disagrees, will they go and bow it all down? I hope not, because it is immanently important to take the citizens and every government that acts like these currently, whether right, if left, if anything, acts unlawful and devoid of any democracy.If you do not understand this now, believe me, the day will come and you will understand.;
1;Schvartur;454;5;452;452;2015-11-20 08:04;"That's why I wrote of electoral programs and no voter could foresee the policy of Mrs. Merkel. Then we would be in ""voting"".By the way, I am one of those voters whose voice is not represented in parliament.I refer the peoples' right of self-determination to a possible dependence of our government on other states, in this case the USA. Already at the NSA A ff äre noticed that nothing has happened and was broken in Germany right, without those responsible were held accountable.All this is very much related to a government crisis. I do not see a refugee crisis, but a government that does not cope with a crisis situation, but contributes, and subsequently reinforces.Before you ask why with caused?Here I am referring to the budget cuts of many states, including Germany in 2015, which means that today the refugees in the camps do not even have the black under their fingernails.Strengthened?If you cut money on the one hand and consciously create incentives on the other hand, people logically set off. Completely rational as people act then.The fact that women and children continue to live miserably on the spot, even though they can come to Germany or Sweden with the opening, is accepted. The CSU contributes significantly to this policy.";
1;pattso;455;4;453;453;2015-11-20 08:05;Or if the evil right comes and then disagrees, will they go and bow it all down?Then I accept the democratic majority decision of the German people and use the miles at my disposal to the opposition.If, for example, I believe that the government is no longer acting within the legal framework, I complain or join a class action lawsuit. I do not complain that Germany is a dictatorship because the government and its actions do not suit me.The situation does not suit me either. I can imagine more desirable than picking up 1 million asylum seekers with dubious integration perspectives. I just think the alternative is even worse.So I'm doing right now and pinch the ass cheeks together. Reply to # 110.9 from Schvartur;
1;Peter Langenhagen;456;1;456;9999;2015-11-20 08:06;"When Merkel says ""to act in the interest of all"", she forgets that she is still the Chancellor of the Germans at the moment. Maybe she wants the Chancellor of ""all""but we do not want that.";
1;pattso;457;2;456;456;2015-11-20 08:07;"Always this ""we"". Write that you do not want that. It's ok but I'm not in her ""we"".";
1;DavidXY;4581;1;4581;9999;2015-11-20 08:08;"No upper limits?I would be interested to know what happens when 60 million refugees are at the door. There are supposedly so many on the run. I will not accept the answer ""that will not happen"". Simply purely theoretical. What happens then? Are there no upper limits?";
1;drstrange2;4582;2;4581;4581;2015-11-20 08:09;"As some forestists here think, ""asylum knows no upper limits"", say, each of the ASYL can somehow pronounce and put a crucifix in a box is welcome so I understood that anyway If this is the idea behind the asylum right, I'll leave it open one day (I would strongly doubt it)";
1;pattso;459;2;4581;4581;2015-11-20 08:10;Then we shoot if necessary. It is clear and most are aware. And until that happens, we'll do our best to keep it from happening.;
1;DavidXY;460;3;459;459;2015-11-20 08:11;You can not close, if there are no upper limits. Or is there anyway?;
1;pattso;461;1;461;9999;2015-11-20 08:12;"Something else.In June / July the BAMF revised the estimate to the numbers. From 350,000 to 800,000.In the meantime, it was full of panic it would 1.5. Millions will be. Which always seemed unlikely to me, because it just did not fit the numbers of the UNHCR. There went Some assume that 10,000 will arrive every day. But they do not come and only came for a short time. Was just scare tactics.Today, the Bavarian Interior Minister named numbers from EAZY and admitted to himself that some DE will probably have left again. And that there are double and triple registrations. And others who are not registered yet.He spoke of 900,000. So we're probably going to land at one million.It follows that the estimate of the BAMF is exceeded by 25%. The estimate was made before Berlin made a policy change. Long before the much scolded ""welcome culture"" began.Who likes now can attribute this 25% alone to the ""welcome culture"". Although a steep thesis but what should it.Conversely, I would finally like to have an answer from the ""borderline"" faction as we should have closed the borders (which would not have worked 100% anyway) WITHOUT pushing the EU & Schengen in front of the wall and without destabilizing the Balkans.So, what would we have done to the 800,000 people if Germany had NOT accepted but they had nevertheless come to Europe?";
1;drstrange2;462;2;461;461;2015-11-20 08:13;"I have no hard facts now, but it seemed to me that there was a first wave at the end of August, which stalled somewhere in the Balkans and then in Hungary. Then the Chancellor did the People are generously informed in Germany you are welcome ... so far so good this Welcome together with the pictures of ""Refugees Welcome"" in Munich and elsewhere, followed by more waves ...The Italians showed how to do it differently in 1991, when a funerary boat with 10'000 Albanians anchored in Bari - Albanians with a boat were returned to Albania. As a result many Albanians also buried their exit plans http: //www1.wdr.de/themen ...";
1;pattso;463;3;462;462;2015-11-20 08:14;For the facts of the numbers: data.unhcr.org At the end of August, around 100,000 people were stranded in Hungary and the country was overwhelmed. The conditions were untenable. Orban could not and did not want to. The people camped in the fields and at the train station. The food issue ran partly like in the zoo.Shortly before, the Macedonian border troops had tried to stop the people on the border with Greece. Went big through the press. This is the first link that Google gives me:https: //www.rt.com/news/3 ...Had not worked. People just stormed and tear gas did not stop them.During the night of 3 September 2015, several thousand people were on the highway on their way to Berlin. Somewhere they suddenly had megaphones, big European flags and carried Merkel pictures.The message was clear: Do something, Germany.Who else should they have ordered? The head of government of Malta?Of course, only Austria and then Germany could have also tried the Macedonian variant. It would not have worked.Maybe, this is pure speculation, we would have massive use of force now 150,000 fewer asylum seekers in Europe. I doubt but it can be yes.;
1;Gauli;464;3;462;462;2015-11-20 08:15;I've read your link. I remember the event in 1991 with dull fuss. Why can not we do that with the Balkan refugees? Yesterday, in our local paper, I read that 47% of the refugees in Ortenau are migrants from Serbia, Macedonia, Bosnia, Kosovo and Albania. Are we actually being sold for stupid? All the time, politicians are babbling about the need to deport these refugees quickly, but they are being housed there, given lessons - and eventually they say they can not be deported anymore. These people are sure to be poor, but then they have to be their home countries Here they take the place of the war refugees.;
1;ZweiundZweigleichVier;465;1;465;9999;2015-11-20 08:16;Just keep that from spreading to North Korea. If this blast sends his army (without any weapons) in here, we'll look a bit modest.;
1;Inselbewohner;466;1;466;9999;2015-11-20 08:17;Now do not sprinkle salt in the wound. It's about the crowd not about the class, that with the class was already bent on us, appetizers for appetizers. Now all we have to do is confide in the mass. It will be more difficult because it is publicly visible, you can not deny it or make a nice speech. I wonder what kind of flowers our politics still give us. One thing is for sure, many will start to think slowly because the basic arithmetic should suit everyone.Kind regards;
1;tansar2;467;1;467;9999;2015-11-20 08:18;Without a limitation, this crisis can not be solved. The amount of refugees is unreasonable.On Thursday evening, ARD, contrasts: refugee misery in Berlin suppression of reality at what price?;
1;nacker55;468;1;468;9999;2015-11-20 08:19;East concrete, nothing except power hold in fifteen years to learn. Paris in Berlin in the Chancellery, otherwise probably no rethinking the reality possible. Good night Germany.;
1;carmelona;469;1;469;9999;2015-11-20 08:20;I do not believe for a second that the bk really believes what she says and that she is truly as humanitarian as she claims. I'm not a conspiracy theorist, but I'm convinced that there's something else behind her actions since this August.either it had a religious enlightenment experience or it is about real macho games, of which we simple folk simply have no idea.the woman is and always has been torn, she has never used for social, for families, for the weak - I just do not take this sudden change from her.;
1;ZweiundZweigleichVier;470;2;469;469;2015-11-20 08:21;"Was never conspiracy theoreticians, but the idea can come.But I remember H. Schmidt ""You always have to reckon with the stupidity of governments"".Maybe she's just Kohl's girl and just stupid?";
1;Dr Eric Turniers;471;3;470;470;2015-11-20 08:22;I think she is completely overwhelmed.Anyone who saw the press conference after the long Greek night in July, where they agreed in principle to give the Greeks up to around 80 billion extra, could only shake their heads:Since she was asked analogously: Yes and what about the emergency aid? Merkel: Uh, what emergency aid?Journalist: Well for the Greek banks (had been closed at that time for some time already), they must be recapitalized immediately.Merkel: (very softly) Oh.That's all she had to say. Obviously, she has nothing further from the Session received. I still thought that perhaps this would be excused by fatigue.However, on the afternoon aftermath of the same day, she appeared at some five-tier xyz ceremony. Like a mayor who has nothing important to do.;
1;MaliceDoUrden;472;3;470;470;2015-11-20 08:23;Not to forget she is with a quantum physicist together. So a physics for which there is no evidence! : D;
1;pattso;473;2;469;469;2015-11-20 08:24;"I do not believe for a second that the bk really believes what she says and that she is truly as humanitarian as she claims.Of course Merkel does not want to reopen the whole world at once. It also has no religious revival experience or has suddenly secretly entered the left.She also did not decide ""lonely"". A lot of consultants were involved and still are. These give situational assessments to other nations, national and European law, and and and.The people came up the Balkans. She could not prevent that. They basically had two options and both were far from ideal solutions. She has opted for lesser evil in her eyes. Did her well.Just take a piece of paper and a pen, turn the time back to the end of August and write down your own ideas with possible consequences. Can eg with a flow chart in the context of a scenario analysis. There are other techniques as well. Just search Google. Is an interesting game.";
1;ZweiundZweigleichVier;474;4;471;471;2015-11-20 08:25;I also remember the legendary Bru??o / Ne??o number.And at the very beginning she was Minister for Women and Dingsda, because there was a discussion about drugs (Campino was also there): Then came out during the discussion that she really had zero idea of drugs, she knew neither substitute Treatment was, as the tubes are called (THC, methadone etc). It was shameful. Campino then explained it to her.Nice also her number, as Schröder had just denied the allegiance to the Iraq war, she flew to Bush two weeks later and said that if she was a Chancellor she would join them.;
1;dertagdanach;475;3;470;470;2015-11-20 08:26;"to # 121.1 Conspiracy theories are plenty. US plan to weaken the EU, plan to defeat Assad mi??el's targeted emigration, etc. etc .. She is not that stupid. She has stupid advisors, though.My assessment: With your decision in the summer she wanted to expose Orban before the public (which succeeded, but this was not). Stupid only that you whispered the wrong text.If they presented the human act as a one-time action and also did not loudly proclaim the special treatment of the Syrians, many things would have been different. The Lapsus was then with required professionals and because barrel bombs, etc. tried to paint over.This will now be practiced without alternative.Germany? Has the lady never interested.Refugees in terms of the Asylum Act? Has the lady never interested.How else can you explain that she advocated a tightening of the asylum law last time in 2013 (Dublin) and that the aid for UNHCR, inter alia, shortened this human act?Incidentally, I expressed this assumption in the forum shortly after her words at SPON and was ""rewarded"" for that. Deletion of the article, blocking of the account. Maybe it's my personal perception? But does not this lady generally have a problem with state leaders of states of the former Eastern bloc?";
1;drstrange2;476;3;473;473;2015-11-20 08:27;"There are already other solutions in the hot August:For example, put all ""stranded"" refugees in internment camps (and not in Germany itself) ... then agree with the EU members on a fair distribution.... make it clear that Germany take on some but certainly not ALL - and if nobody picks up, the people stop in the detention center ....I know, needs some corneas, but would have been understood by the ""travelers willing-but-waiting"" so that the trip ev. Not worth it (maybe I'm coming to Lithuania, because I feel no better than in the Turkey and it is still a lot colder in winter)";
1;pattso;477;4;476;476;2015-11-20 08:28;"eg putting all stranded ""refugees into internment camps (and not in Germany itself)""The Federal Chancellor is the Government of the Federal Republic. She can not even set up internment camps in Germany without asking the federal states and without the BVG knocking on her fingers.We are not France around 1680.Still less can she order internment camps anywhere in Europe. She can call what she has done in Athens and finally build up appropriate camps.Then you say Trispras, yes clearly Angela I do, hangs up and does little. Otherwise he would have a problem with the hacking.The same game in Serbia or Hungary.Orban even whistles his police back and lets people rush their trains at night. Without calling in Vienna or Berlin before.""then agree with the EU members on a fair distribution, Germany pick up a few but certainly not ALL -. ""Yes, you can and that's what you and Junker and Faymann and Renzi and a few others are trying to do. It takes time.""and if nobody picks up, people just stay in the detention center""That's just not possible. See above.The other countries DO NOT WANT to keep in internment camps. Of course, the few Greeks in the worst economic crisis since 1929 do not want to become Europe's camp. They know exactly when they are all with us, the EU does not care anymore.";
1;dertagdanach;478;3;473;473;2015-11-20 08:29;"to # 121.4 No! Did she do bad! Open your eyes! Currently, much of Europe is destabilized.The people came up the Balkans. Yes! Why?Because people from the Western Balkans are fleeing from poverty. In the""Merkelland"" there is a good Euro Hunni for free, food and lodging free of charge, plus a patient care.In the Western Balkans, the monthly wage is often 200 - 300 euros. For this people sometimes have to work hard and pay for food and housing.However, these people are expected to carry tens of thousands of travelers as part of the ""humane movement"".Why?Because people flee from the large gathering camps in the Middle East and Greece due to poor living conditions.Why are the conditions bad there? Because, inter alia, Merkel (Germany is the largest payers) has cut back the Mi für?l for the camps. Incidentally, the US is also considerably in debt here. Inquiries to UNHCR will prove this.Did you do well? She has these sh. e with displayed. Because of good. She buried herself deep in the bathroom.";
1;Dr Eric Turniers;479;5;477;477;2015-11-20 08:30;They could also send the German navy to Turkey and the refugee boats can be hauled back to the Turkish coast. If she wanted it, there were many possibilities, except to say that everyone comes here and also to emphasize that there is no upper limit. Dumber is not really.;
1;pattso;480;6;479;479;2015-11-20 08:31;"You could also send the German Navy to Turkey and have the refugee boats towed back to the Turkish coast.That too you could not do. For various practical reasons not (which navy?) And for reasons of international law not (the German police are not allowed to operate simply in Switzerland) and for reasons of strategic alliance policy. Turkey may be a difficult NATO partner, but it is a tremendously important one.At Google simply enter ""territorial waters"".";
1;pattso;481;4;478;478;2015-11-20 08:32;"Because people from the Western Balkans are fleeing from poverty.The approximately 800,000 that landed this year on the coasts of Italy and Greece came from the Balkans? How can I imagine that? Did the Albanians book the flight to Istanbul, did they drive to Izmir by bus and did they allow themselves to be smuggled by boat to Lesbos? Because of the ""Euro-Hunni for lau"" from the back through the chest in the eye?Asylum seekers from the Balkans are a problem but a complex other problem. Has nothing to do with the Afghans, Syrians and Iraqis. We also get the problem in the grit. Has already happened in the main features.""Why are the conditions there bad because, inter alia, Merkel (Germany is the largest payers) has cut back on the Mi für?l for the camps Incidentally, the United States are also still significantly in debt here."" Inquiries at UNHCR will prove this.That's right. That's her fault. The UNHCR warned early and hardly anyone has responding. DE hä? ? e because sometimes the missing payments from other countries to compensate. Would have been better. Although a huge screaming of the AFD and Pegida had the consequence but be it drum. They are screaming anyway.PS: The missing camps in GR and elsewhere are NOT a responsibility of the UNHCR and have nothing to do with the missions for Welthungerhilfe. Other construction site.";
1;dertagdanach;482;5;481;481;2015-11-20 08:33;"ad # 121.12 My remarks related to why and which people are moving north across the Balkans.On the one hand, inhabitants of the Balkans, who are fleeing bad living conditions. On the other hand, people from Africa and Asia who escaped from the large collective camps due to poor living conditions.Merkel has decided to reject the Balkan refugees, but not the others.This decision is highly explosive. Explain to an economic refugee from the Western Balkans why the economic refugee from Africa or Asia is preferred.You understand what I mean? Merkel has partially suspended the case-by-case examination of the asylum law.On the subject of Greece: In the course of protracted negotiations, the Greek government repeatedly raised the issue of ""refugees"". That went from the cry for help to blackmail.Merkel has done nothing for it. Important was the bank resolution etc .. The refugee issue was not treated separately.Sta? ? of which she has enforced another aid package, of which one knew in advance that it will not be enough (without Schuldschni?.).Then to expect that Greece manages the refugee flow almost alone, bordered on purpose.Great, when people praise a politician who ""solves"" part of a huge problem (conditions at the railway station in Hungary there / refugee flow from the Middle East there), a huge problem that she has co-responsibility.Great as rabies.";
1;pattso;483;6;482;482;2015-11-20 08:34;We know that we have a problem in the Balkans. It's great that you're one of the few people who think about the causes of the Balkan refugee movement. And that the problem does not disappear if we push people back there again. That's why she could not close the borders. To the problems of Serbia still refugees on top of it? Not a good idea.Otherwise, I think Merkel benefits from her commitment to the Balkans. Partially more noticed by the foreign press than by the Germans. But is a complex field with many interests and problems.GR. That, too, was less one-sided than what you said. GR has already received funding from Brussels months ago. The onslaught began in May, starting in June it was serious and in July Junker waved the money. The problem with GR is that they can blast the land with money and nothing is going on. Get the Schuldschni? die but it is enough if he is regulated until 2019. Previously only important in domestic politics and Varoufakis was a trophy in the negotiation.Merkel is not the queen of Europe. That was always a lie. The can not meet the Tsipras one-sided all heart's desire, nor with the Finns & Slovaks only tighten the thumbscrews. In addition to the job of bringing a herd of cats to compromise, she should also represent the interests of Berlin.She made mistakes.;
