Artikelnr;acc_name;Gesamtnr;row;ausg_nr;beznr_komm;relative_date;text;
1;ithox;615;1;615;9999;2015-11-20 10:45;"No upper limit, that does not sound like a plan for me.You can tell me that we can absorb ""much more"" than now. That may be true. At some point, however, a limit is reached on receptivity, for different reasons. How many people can still be taken in real, 20 million, maybe there is the limit of 200 million?You will not be able to reach the last number. We live in a real world and not in an imaginary world where everything is possible, you just have to ""want it"".Motivational speeches ansta realistic planning.One also likes to confuse the terms ""economic migrants"" and ""refugees"".All of a sudden these are ""refugees"", except the Balkans, but at the same time they bring something to our economy and come from safe countries. Several comments have already been written about this, but it does not seem to have spread.";
1;Kröte 123;616;2;615;615;2015-11-20 10:46;Away.;
1;Griesoss1;617;1;617;9999;2015-11-20 10:47;"I almost never imagined (as an old SPD voter) that the CSU would agree. From the WORLD: ""She (Merkel) has the"" upper limit "", not even mentioned as a point of discussion, but literally excluded for the future.... the Bayer is on the verge of insolence, but he has the delegates behind him. Seehofer, who is actually threatening her: ""We'll see each other again on this topic."" Ho ff entlich soon, and in the public eye - as it is so beautifully - sustainable and in the INTEREST of Germany and the German people.";
1;ZweiundZweigleichVier;618;1;618;9999;2015-11-20 10:48;I'm almost ready for an annexation by Russia as a variant.;
1;Petra Q;619;2;618;618;2015-11-20 10:49;... because the (Eastern) Ukrainians can provide information about how that is. By the way, you can find Ukrainian refugees in Romania (I guess, even in Bulgaria, but I did not see that myself). Perhaps here, too, the German side should first check where there are con fl icts everywhere in the East and where people are fleeing.Even if that is the medial focus in the Arab world.Russia (Putin) does an excellent job in Syria, forgetting what happened in Ukraine. Therefore, be careful with such wishes!;
1;UNAU;620;2;618;618;2015-11-20 10:50;No, it's not.;
1;ZweiundZweigleichVier;621;3;619;619;2015-11-20 10:51;It goes without saying: it was meant sarcastically. I also do not want to go to war with him and his number with Eastern Ukraine (not so much with the Crimea) is the worst for me Sauce, but also here: Our EU strategists are not so nonsensical dragged on the Ukraine, who knows, maybe you can give all this. He should only save us from Mrs. Merkel :-)The man is more European than our Chancellor and when I think of 2 interviews (old) of him, Russian, what he has said about Germany, makes me suspect that he respects Germany culturally more than our Chancellor does, sorry that I have to say it that way. But I did not hear that from Mrs. Merkel about D. yet and it was not a courtesy interview to German journalists.;
1;Fanz Egli;622;1;622;9999;2015-11-20 10:52;As long as the 1 million refugees are still in the mass housing, often in structurally weak areas and not yet in the citizens in the neighborhoods and cities, the average person does not notice much of it. That will change soon.Also change is the view that all this will not cost so much and the black zero will be feasible. The majority of Germans will soon wonder what enormous costs we will receive. When every worker has 10 percent less income, many will wake up.The only question then is whether it will not be too late.;
1;ZweiundZweigleichVier;623;2;622;622;2015-11-20 10:53;Away. Avoid crude statements. The editorial o?ce / mak;
1;ithox;624;2;622;622;2015-11-20 10:54;"The situation is similar with Greece. The Greek debts are growing, here a debt bill, as a sale of state property, but the mountain is getting bigger. There come as ""Re ? lti ung"" the auxiliary packages.It is flipped so that nobody realizes it. This is not a future-oriented approach, I think.How that ends with the ""migrants / refugees"", will also show the future.It would probably help people more, including women and children, if they did more on the ground, but that does not seem to be the plan if there is a plan.";
1;ithox;625;2;622;622;2015-11-20 10:55;"I forgot the most important thing. That's all ""no alternative"".Miss Dr. Merkel someday studied physics, I somehow do not see that in her way of thinking. No plan, no hypothesis, theory, verification, but ""that's how it must be"" (because I want it that way).";
1;ZweiundZweigleichVier;626;3;625;625;2015-11-20 10:56;Her thinking may correspond to Heisenberg's uncertainty principle: she may be able to formulate a thought, but she does not know where he is going or where he's from, but once she has done that, the thought is gone again.;
1;Dr Eric Turniers;627;3;625;625;2015-11-20 10:57;There are still people in the STEM subjects who manage to muddle through somehow. And Merkel was politically well connected - so far, I do not think her physics studies should be taken too seriously. And her doctoral thesis is somehow not audible.;
1;Schönheit;628;4;627;627;2015-11-20 10:58;And her doctoral thesis is somehow not audible. But she is:h? ? p: //de.plagipedi.wikia ...In fact, the rationality that scientists generally say is unfathomable. Maybe she's been out too long already. Is not she getting well.;
1;Schönheit;629;5;628;628;2015-11-20 10:59;"However, rationality is not invisibleOr it is a rationality that does not conform to the commonplace. One forensic scientist pointed out the book ""Die Patin"", written by Gertrud Höhler about Angela Merkel.In addition two links:An interview with Ms. Höhler in the HNA: ""Imperialism with a cloak of invisibility"" www.hna.de/politik/interv ...And at Phoenix: ""Angela Merkel is working on the collapse of democracy"" www.youtube.com/watch?v=r ...Highly recommended!";
1;Fanfare;630;1;630;9999;2015-11-20 11:00;... with Merkel to demand that EU and foreign countries are in the obligation.Do you belong to the small group of Germans who still have not realized that the others have no interest in wanting to have mass refugees in their countries?Merkel's arm league squad is quite alone and abandoned - the German media, however, try to ignore this European reality and pray their mantra from the distribution over and over again.Merkel either needs a new Wehrmacht to implement her idea of the new German world or she will try the checkbook.No matter how she will try - the others will not follow Merkel's Islamization project. They would rather forego EU funds and not blame their country for the German madness.;
1;ZweiundZweigleichVier;631;2;630;630;2015-11-20 11:01;Checkbook: In my opinion, Merkel misunderstands in her basic error that national responsibilities are not a question of money. That's why their stubbornly astonished reaction, as the Visegaard States recently categorically refused.;
1;WernerS53;632;2;630;630;2015-11-20 11:02;The rest of the EU is taking the unique opportunity to make Mu ? ? tough.;
1;ZweiundZweigleichVier;633;3;632;632;2015-11-20 11:03;"Yes, you always see each other twice or ""revenge is a dish that is best served cold"".";
1;Griesoss1;634;2;630;630;2015-11-20 11:04;"Can anyone answer the following question: ""Which GOVERNMENTS in Europe or other countries worldwide fully welcome the 'refugee policy' Merkel and call them exemplary and want to emulate her?"" I'm looking forward to the answers.";
1;ithox;635;3;632;632;2015-11-20 11:05;The rest of the EU Merkel is personally probably do not care. They do not want German chaos.;
1;ithox;636;3;634;634;2015-11-20 11:06;"@ Griesoss1 The other countries are probably glad that the refugees applaud ""Germany, Germany"", to say ""Mu? ? i Merkel"".In Australia, apparently, a ""refugee boat"" has just been returned to the starting port. Other countries, other countries.The government is silent about such actions, because they basically do not want to comment on this. ""No illegal boats should reach Australia,"" they say,and that's the story.The take on refugees, but not without verification.Well, Germany, where some call for ""open borders"", that's pretty much something else";
1;kopfohnebrett;637;1;637;9999;2015-11-20 11:07;Every human being in this world is legal.Borders are Hinnngespinste from the 19th century.Anyone who needs help urgently needs help from people who are just fine.;
1;gue_feldhaus;638;2;637;637;2015-11-20 11:08;Why are you so unfriendly here and let the refugees march 3000km miserably first u. Pay thousands of smugglers before they finally get here with apple pie u. Teddy Bears to be received?If you were really as good-hearted as many here always do, why not send ships to the Lebanese coast and bring the refugees safely to Germany?;
1;UNAU;639;2;637;637;2015-11-20 11:09;The world is not like that.;
1;ithox;640;2;637;637;2015-11-20 11:10;So far to theory. You only need to make a small adjustment in the brains of the people. Otherwise, your approach to reality is over.Basically you are right, I fi nd, but it is not feasible. Ansta ? Black and white you have to look for pragmatic solutions, otherwise it fails in the real world.The borders did not originate in the 19th century.;
1;WernerS53;641;2;637;637;2015-11-20 11:11;If you are simply too well, there is a form for every city administration: Declaration of obligations according to § 68 in conjunction with § 66 Residence Act You are welcome to give personal assistance.If that's too expensive for you, or you're too cowardly to fill in, sign and send a few forms, why should the state do it?;
1;kopfohnebrett;642;3;639;639;2015-11-20 11:12;I know that the world is not like that.But in such a hooded world only visions help.But not such negative, right-wing visions that are not, because we only need to look into our own past. These visions have failed great!;
1;ithox;643;4;642;642;2015-11-20 11:13;"@ kopfohnebre ? ""If someone has visions.""Democracy is a vision that seems to work. In Africa or other countries democracy does not exist. There are still kings as rulers, dictators (North Korea) etc.It is not a vision to change the existing, reasonably functioning, structures in an attempt to ""rebuild the world"".Don't fix if it aint broke.You really should start where it burns the most, in my opinion. To invest in education in other countries. Helping people to improve their countries. There are 6 billion people who are ""worse off"". Do you want to bring everyone to Europe?";
1;ZweiundZweigleichVier;644;3;641;641;2015-11-20 11:14;Incidentally, since the fall of 2014, this has already been widely practiced by appropriate gangs: people with little coal were given employment contracts (apparently), 6 months, the money was repaid again, and then this person was able to sign a declaration of obligations and someone could enter. The helper got then around 3500 €, if the status of the immigrant was clarified, the AV was dissolved by notice. The helper was unemployed, the immigrant for the first time here. The helpers were often also people with double citizenship, who did not live here anyway, then went back to their homeland.;
1;Dr Eric Turniers;645;2;637;637;2015-11-20 11:15;So in the animal world, there are areas that are marked and defended, whether individually or in pack. Securing your own territory is certainly a very deep-seated instinct even in humans. The modern social theorists just do not want to know that.And young people may not be able to appreciate the emotional role played by homeland.;
1;PatrickFeynman;646;2;637;637;2015-11-20 11:16;"The people who are doing well in Germany can and should like to help. The only problem is that many Germans are not so well fi nanced that they can just help, even though they want it.70 percent of the workforce earns less than € 30,000 bru ? o per year. That's the reality!You can argue that the refugees are much worse off. But how well you feel is a very subjective feeling. My problem is that of the people who demand a completely unlimited, ""unregistered"" entry into Germany, I hear no suggestions as to how these people in Germany should be provided and housed in a decently dignified way, and above all, what in the future should happen to these people. How should a reasonable integration in the shortest possible time by at least 3 million people work? I have some suggestions, but from the ""left"" I read like on the part of the ""Right"" (here very few) only dull insults and polemics. Why can not be discussed objectively and reasonably about contents, causes and solutions? Incidentally, there are many comments here that try to lead the discussion on a factual level.";
1;Albrecht Zweistein;647;2;637;637;2015-11-20 11:17;Away. Return to the article topic. The editors / ncg;
1;Toadstool;648;1;648;9999;2015-11-20 11:18;Ms. Merkel has distracted herself from the will of the majority of the population to a degree that I never considered possible with this opportunist woman. She risks her political power, but unfortunately for the wrong thing. If things continue as they have done until the end of 2017, the Union will face a debacle in the election. Whoever follows Merkel will inherit an unprecedented chaos, while the polluter can then make herself comfortable on her retirement seat in the Uckermark.;
1;ZweiundZweigleichVier;649;2;648;648;2015-11-20 11:19;My thought: She will not compete in 2017, she had already hinted that before (even before the crisis). Why, she did her life's work. The soup must trigger the other then, we.;
1;Griesoss1;650;2;648;648;2015-11-20 11:20;"Someone once said: ""Give me four years, and you will not recognize Germany."" Angela Merkel and her ""refugee policy"" will not take so long!";
1;Logischerweise;651;1;651;9999;2015-11-20 11:21;"From this power-obsessed woman one hears only the same phrases, above all those of the ""better distribution of the 'refugees' on other European countries"". You can not hear it anymore, how often has this been tried unsuccessfully - almost all other countries refuse. But this woman does not want to move away from power, fearing that concession of reaching capacity would mean her return. Her will to power is thus greater than her sense of responsibility for the country that governs her. With her attitude, she makes the policies of the opposition parties and locks CDU / CSU, which do not want this policy in the vast majority of practically a. She would have to be overthrown by her own party - and that's not so easy. Mrs Merkel does not seem to want to think about how the immigrant flow will affect many areas in a few years, if not months. She seems cold to me and it does not seem to bother her to be seen as the Chancellor who most hurt DT the next time. If it comes to civil war here, she bears the main blame.";
1;Moritz.Grattke;652;2;651;651;2015-11-20 11:22;Merkel overthrow? Just now? That's way too late! And to topple them because of the refugee problem, IS would be most pleased: they managed to drive a wedge between the conservatives and drive Germany into the right corner.Which decent democrat would allow this? Victory would be certain for the IS if we drove the Srs back into the arms of the IS-butchers they fled! The IS would be happy! Victory would be safe for the IS!Does your AfDler want that? The Pegidaists and the NPDers want that because all foreigners are not worried. But the rest of the right wing should not be ignored by refugees from Syria!;
1;Moritz.Grattke;653;1;653;9999;2015-11-20 11:23;"Merkel has never seen such frustrated and with folded arms. Alone, without support from the CSU. Pathetic. But this imitation of Seehofer and the Dumpfbacken the CSU Merkel has not earned. You have to support them as a democrat! No upper limits!Quotas - yes! But these Bayern and their Wortglauberein vergeigen everything. The one mixes refugee policy with terrorist attacks, the other calls: No, that's not how it works, then it's going backwards, everything was not meant, then it's shot across and even the federal government in which the CSU-pseudo-academics themselves are sitting, for high treason indicted. Dorky does not do that anymore! The Bavarians probably have no taste for Oktoberfest and Maßbieren !? ""Brain amputee"" would say the old ostrich ... which he just and for once exceptional right!";
1;ZweiundZweigleichVier;654;2;653;653;2015-11-20 11:24;Irony?Let's talk about Franz Josef Strauss. I do not want to explain what Strauss would say about the policy of a woman Merkel. Maybe he's just talking and we're getting a winter storm this weekend.;
1;Immer Bandsalat;655;2;653;653;2015-11-20 11:25;Would Strauss say well.But probably. not in the direction of CSU, I think.;
1;dertagdanach;656;2;653;653;2015-11-20 11:26;ad # 168 You know what the asylum policy of FJS looked like?;
1;Albrecht Zweistein;657;2;653;653;2015-11-20 11:27;I wonder just how high the security standard of German madhouse is in terms of Internet activities.Of course this has nothing to do with their posting ... very clearly!;
1;Moritz.Grattke;658;3;657;657;2015-11-20 11:28;"Hm, one cites once an otherwise deeply despised corrupt political crook to give him a single time right, and then you will be back a ? ackiert. One can not do it right nowadays .... Well, whoever finds irony ....But it also seems to me that the ""worried citizens"" have no place in the madhouses they mention. You have to fight them differently. But how do you fight a Bachmann and at the same time the Söders and Scheuers?The CSUlerInnen and CDUlerInnen are indeed known rather the right ones (Mollath and the tax inspectors of Hesse) in madhouse than to treat yourself!";
1;Moritz.Grattke;659;3;654;654;2015-11-20 11:29;oh well, of course, the ostrich hä ? e 1. the DDR wall kept closed and 2. drawn around Bavaria still a wall!;
1;H_o_C;660;1;660;9999;2015-11-20 11:30;From www.faz.net/aktuel ...Let's see how long the French have let the politics of the open borders put up with.;
1;DerZeesener;661;2;660;660;2015-11-20 11:31;;
1;dertagdanach;662;3;661;661;2015-11-20 11:32;"Similarities with the Afghanistan war are pure coincidence, German top politicians spearhead the fight against Islamist terrorist groups. Fight against Taliban and Boko Haram with the help of the Bundeswehr, fight against IS with welcome"" signs.What are you waiting for?";
1;Zuzanna;663;1;663;9999;2015-11-20 11:33;"Why did Merkel bring the CDU / CSU back to power after Schröder, why could she even consolidate the power?If, in a real situation, more politically right-wing measures are the only economic and optimal solution, this would have to be handled by Mrs Merkel.Ms. Merkel's disaster is thus called bad problem solving in a huge problem dimensions. It could be ""complicated times"" approaching us.";
1;ithox;664;2;663;663;2015-11-20 11:34;--- irony o ff ---;
1;WernerS53;665;2;663;663;2015-11-20 11:35;Merkel also has no interest in an economic and optimal solution to any problem, no matter how small or so immense.A solution? I do not care Merkel wants to remain Chancellor.;
1;blasfemy;666;1;666;9999;2015-11-20 11:36;Capturing migrant flows in unlimited numbers and doing nothing are not an option in the 21st century.;
1;sanne177;667;1;667;9999;2015-11-20 11:37;"Gertrud Höhler has written a good book about Angela Merkel, 2012, ""The Godmother"" and in the HNA is a good interview with Gertrud Höhler appeared, title: imperialism with magic hat hna.de/politik/interview-merkel-imperialismus-tarnkappe-5649289 .htmlWhat she already described in 2012, we are now experiencing it with the terrible consequences for us and our country.";
1;ZweiundZweigleichVier;668;2;667;667;2015-11-20 11:38;Since I had to think of it often, at that time I thought, the Höhler exaggerates something, today you have to say: Exactly so it is.;
1;Petrichor;669;2;667;667;2015-11-20 11:39;Does not Merkel's attitude convey an inner commitment to Christian charity?Höhler: When I take responsibility for people in need, it is a Christian duty. But if the sheer masses do not allow them to act responsibly, I owe them.Thanks for the link.;
1;Schönheit;670;2;667;667;2015-11-20 11:40;Thanks for your hints.Here is the link to the HNA article: www.hna.de/politik/interv ...And an interview with Gertrud Höhler: Angela Merkel is working on the collapse of democracy - highly recommended!www.youtube.com/watch?v=r ...;
1;ZweiundZweigleichVier;671;3;669;669;2015-11-20 11:41;But just because it's so easy, it's clear: it's not about reason, it's about pure ideology, Merkel, Gabriel and Stegner and all the others. It is also no pity. It is ideology. They want another Germany. In former times one called such a coup.;
1;Fix und Fertig;672;1;672;9999;2015-11-20 11:42;"Wolfgang Schäuble called today the immigration figures ""unbearably high"". The policy of the open border, and Mrs Merkel and Mr Gabriel, who bring us these conditions, are unbearable.The CSU organizes only a colorful political show, but supports in the end again and again Chancellor. The fact that the CSU consistently pursues the destabilization and Islamization of Bavaria and Germany is a joke of history.";
1;DerZeesener;673;2;672;672;2015-11-20 11:43;maybe you should give söder a chance ...;
1;blasfemy;674;1;674;9999;2015-11-20 11:44;Lately Merkel's keynote address has passed without emphasizing the special responsibility for Israel. That may be alright, the question is what does that mean? Has something escaped me, does that also have a legal rank?;
1;ZweiundZweigleichVier;675;2;674;674;2015-11-20 11:45;"Maybe she wants to prevent, because she does the opposite:The thing is that we soon can no longer make a rational foreign policy with further intake of such quantities: any support from Israel is indeed more difficult, since then you risk a civil war at home (was in Denmark already almost the case).We should therefore understand it so: ""I said it again, if you can not keep it after the promise, then this is your problem.""";
1;Griesoss1;676;1;676;9999;2015-11-20 11:46;Last year, I still hailed her, and I will use all the Democratic Misles to prevent her from further chancellorship!Says a CSU member. I've never hailed her as a former SPD voter, but now I'm on the side of Roland Gaßner, a delegate from Neuburg-Schrobenhausichen. (see FOCUS online);
1;Osteuropaeer;677;1;677;9999;2015-11-20 11:47;If this older woman wants to make Germany happy with young emigrants, that's the German thing. But if it first invites the young immigrants without any restrictions and then forces other nations to accept these emigrants, then one wonders whether something is wrong with this matter.;
1;ZweiundZweigleichVier;678;2;677;677;2015-11-20 11:48;So it looks like a big number here, I would say. Merkel makes us at the Osteurop. States and throughout the EU impossible. It has often happened in the last few weeks and months that I was ashamed of being German in the face of behavior and expressions towards our neighbors (especially Gabriel and Stegner).Stay strong against Merkel where you come from, this is likely to be our only and last chance in Europe. Reply to # 172 from Osteuropaeer;
1;Logischerweise;679;1;679;9999;2015-11-20 11:49;Away. Bi?e be more objective to other users. Thanks, the editors / ncg;
1;Milarepa;680;1;680;9999;2015-11-20 11:50;It was announced this evening by the Public Prosecutor of Paris that 2 of the 3 Kamazazes who blew themselves up in front of the Stade de France were registered in Greece on 3 October and joined the Flüchling stream (France 2).;
1;ZweiundZweigleichVier;681;2;680;680;2015-11-20 11:51;"Everybody has lied to the citizen since Friday. One should print out these messages and blow them around your ears.My grandmother hä?e said: ""Something does not belong, they wanted to be 3 ashamed of something"".";
1;Milarepa;682;3;681;681;2015-11-20 11:52;Two of the three suicide bombers at the Stade de France were checked in early October in Greece. They would have mingled with migrants fleeing the war in Syria.;
1;ZweiundZweigleichVier;683;4;682;682;2015-11-20 11:53;"Normally, everything sounds nicer in French, but here you get a tantrum because of those bold lies.As it was said: ""We have no knowledge."" 2 Everyone said it.";
1;ZweiundZweigleichVier;684;1;684;9999;2015-11-20 11:54;Focus reports on congress as follows: h?p: //www.focus.de/polit ...;
1;JustMy2ct;685;1;685;9999;2015-11-20 11:55;"Why should my country change so fundamentally (the burdens are borne by people, like me), when of course only we, with our typical German sense of mission, have to scream loudly ""here"" all the while, when there are uncomfortable things to distribute in the world. It's way too much, too fast, and too illegal, what's going on here, and the actual (co-) polluters (see Iraq war) like USA, UK, Poland, etc ... are holding back nobly or having discussions, that you can not listen to. And Europe is only good for agricultural subsidies, and special rules for GB.I do not know when Ms. Merkel once speaks normal people, all of whom, like me, are located in the bright part of Germany, and do their work and pay taxes. My thinking is not unique.It is about time that we were presented with an overall concept for citizens, that we should constantly hear from our shrugging Government that they are at the mercy of the event. What was I really in the fight for in the cold war - to hear years later that it was superfluous: you can not secure borders, and you no longer protect your country today.";
1;ZweiundZweigleichVier;686;2;685;685;2015-11-20 11:56;It's about time we got the A. up here in the west and hit the road.;
